{"timestamp": "2026-02-22 13:37:01.996484", "input": "DISCHARGE SUMMARY\n\nPatient Name: Rajesh Sharma  \nAge: 58  \nSex: Male  \nAdmission Date: 12 Feb 2026  \nDischarge Date: 16 Feb 2026  \n\nPrimary Diagnosis:\nAcute Inferior Wall Myocardial Infarction (Heart Attack)\n\nProcedures Performed:\nEmergency coronary angiography followed by successful stent placement in the right coronary artery.\n\nHospital Course:\nThe patient presented with severe chest pain and sweating. ECG confirmed myocardial infarction. A drug-eluting stent was placed without complications. The patient remained hemodynamically stable post-procedure.\n\nDischarge Medications:\n- Aspirin 75 mg once daily\n- Clopidogrel 75 mg once daily\n- Atorvastatin 40 mg at bedtime\n- Metoprolol 25 mg twice daily\n- Pantoprazole 40 mg once daily before breakfast\n\nActivity Instructions:\n- Avoid heavy lifting for at least 2 weeks.\n- Begin light walking daily as tolerated.\n- No driving for 1 week.\n\nDiet:\nLow salt, low fat cardiac diet. Avoid fried foods and red meat.\n\nFollow-Up:\nCardiology review after 7 days.\n\nWarning Signs:\nSeek immediate medical attention if you experience:\n- Chest pain\n- Shortness of breath\n- Excessive sweating\n- Palpitations", "output": {"triage_level": "low", "medications": ["Aspirin 75 mg once daily", "Clopidogrel 75 mg once daily", "Atorvastatin 40 mg at bedtime", "Metoprolol 25 mg twice daily", "Pantoprazole 40 mg once daily before breakfast"], "activity_guidance": ["Avoid heavy lifting for at least 2 weeks.", "Begin light walking daily as tolerated.", "No driving for 1 week."], "warning_signs": ["Chest pain", "Shortness of breath", "Excessive sweating", "Palpitations"], "red_flag_actions": [], "follow_up": ["Cardiology review after 7 days."], "patient_instructions_simple": ["Take your medications as prescribed.", "Avoid heavy lifting for 2 weeks.", "Start walking slowly.", "Don't drive for 1 week.", "Call immediately if you have chest pain, shortness of breath, excessive sweating, or palpitations."]}}
